screen_name,created_at,text,in_reply_to_screen_name,retweeted_status_screen_name,user_description,source,lang,id
kutsavaki,2021-01-29T15:08:48Z,"Εν τω μεταξύ κατι μου λεει οτι αυτές που βιάστηκαν ή εχουν υποστεί κακοποίηση δεν θα μιλήσουν γιατί πετάχτηκε σαν την πορδη και η κουτσή Μαρία να πει την πίπα της.
Διαφημιστε σοκοφρετες στο ινστα και αφήστε χώρο για τα αληθινά θύματα.
Τα ίδια ρεζιλίκια με το #metoo στην Αμερική..",,,ήρθες στο «λάθως» μέρος,Twitter for iPhone,el,1355171040079577090
tebelhanas,2021-01-29T15:06:30Z,Σταματήστε κάπου με το pretty privilege. Η εξωτερική εμφάνιση δεν υποτιμάει (ή υπερτιμαει) καμία πράξη. #Σπυροπουλος #metoo https://t.co/vUy1TiVHu5,,,I-,Twitter for iPhone,el,1355170459764088832
olga48778863,2021-01-29T15:06:09Z,"Οι σκεψεις των παιδιων , μας δινουν ελπιδα!
https://t.co/VlZUoFbstA
   #metoo",,,"Μπορείς να κόψεις όλα τα λουλούδια,
αλλά δεν μπορεις να εμποδίσεις 
την Άνοιξη, να 'ρθει.
PABLO NERUDA",Twitter for Android,el,1355170374007336967
Thalassinh,2021-01-29T15:06:03Z,εννοείται ότι και στο χωρο της εστίασης γίνεται το έλα να δεις.....😠#MeToo,,,"Λατρεύω την θάλασσα. Συλλέγω μανιωδώς συνταγές. MedicalManiac. Σιχαίνομαι το ψέμα, δεν υποκύπτω σε εκβιασμούς κ φροντίζω να κοιμάμαι ήσυχη τα βράδια...",Twitter for Android,el,1355170349202219015
Aspa19Aspa,2021-01-29T15:05:56Z,Αν είναι δυνατόν να ακούστηκε ότι είναι ωραίος ο  #σπυροπουλος οπότε εντάξει δηλαδη αν δεν είναι ο ωραίος  υπόθεση #mpekatorou θάψ’ τον κι αν είναι κάτσε του να γίνεις φίρμα?? Μα τι ακούω πια έλεος έχετε και κόρες κάποιοι!! #MeToo #Kimoulis,,,tweeterou instagramer fashio ico και vga κτλ κτλ ααα και movie και series lover! do what you want to be 😃!!,Twitter for iPhone,el,1355170317220634626
Maximil44397219,2021-01-29T15:01:48Z,"Δεν εχει το ιδιο βάρος με την σεξουαλικη παρενοχληση αλλα υπαρχει κ το ειδος των συναδελφων οι οποίοι σε ""πειραζουν"" κ εσυ αν δεν το ανεχθεις σε αντιμερωπιζουν ως κρυα οπισθοδρομική κ beach #MeToo",,,οταν τους λεω οτι ακουω opera γελανε....🤪,Twitter for Android,el,1355169279415615492
Nikolina_Ch,2021-01-29T15:00:52Z,"Είναι καιρός να ανοίξουν τα στόματα και να βγουν στο φως όλες οι περιπτώσεις κακοποίησης, είτε είναι σεξουαλικής φύσεως είτε όχι, από κάθε κλάδο εργασίας ή και εκτός εργασίας. Καμία γυναίκα δεν είναι μόνη και όλες θα μπορούσαμε να είμαστε στη θέση τους. #MeToo
#Σπυροπουλος",,,I love reading and writing and I really like photography.,Twitter for Android,el,1355169045746757636
Opamariposa12,2021-01-29T14:59:40Z,Να ανοίξουν τα στόματα και για τα πολύ βαριά ονόματα με μεγάλη εξουσία. Γιατί αν δεν πέσουν τα μεγάλα κεφάλια η κατάσταση αυτή θα διαιωνίζεται. #metoo #κιμουλη #σπυρόπουλο https://t.co/xGCuIapC3z,,,,Twitter Web App,el,1355168742452457472
protagongr,2021-01-29T14:59:39Z,Παρενοχλήσεις στο ΑΠΘ: Φάκελο με 1.500 καταγγελίες κατέθεσε ο πρύτανης  https://t.co/PIPH8kQkvj #metoo,,,,Twitter for iPhone,el,1355168738493026304
dictatorianus,2021-01-29T14:59:01Z,"Άμα δεν γουστάρετε κάποιον τώρα είναι η ευκαιρία που ξεκίνησαν τα λαικά δικαστήρια
#Σπυροπουλος #MeToo",,,"""Διαφωνώ με όσα λες αλλά θα υπερασπιστώ μέχρι θανάτου το δικαίωμα σου να πας διακοπές στην Μακρόνησο"" 
Γεώργιος Παπαδόπουλος, επιβήτωρ αριστερών και ΝΔουληδων.",Twitter Web App,el,1355168579491155970
SputnikGreece,2021-01-29T14:59:00Z,"Ο Γιάννης Στάνκογλου μίλησε για τις δύσκολες καταστάσεις που πέρασε κατά τη διάρκεια συνεργασίας του με συγκεκριμένους σκηνοθέτες. #metoo 

https://t.co/MzfwtGIEee",,,Μιλάμε για όσα οι άλλοι σιωπούν,TweetDeck,el,1355168572927062021
Ch_Hortareas,2021-01-29T14:58:25Z,"Όταν εκφράσεις όπως ""είπε όχι αλλά θέλει"" και ""θα κούνησε και αυτή την ουρίτσα της"" ακούγονται καθημερινά δεν πρόκειται να σταματήσουμε να ακούμε για περιπτώσεις σεξουαλικής παρενόχλησης. #MeToo #Σπυροπουλος #κιμουλη",,,Δημοσιογράφος - Πολιτισμολόγος,Twitter for Android,el,1355168426696859648
eironmann,2021-01-29T14:58:12Z,"Στο καμαρίνι του Κιμούλη υπάρχει πάντα ένας σάκος του μποξ για το ζέσταμα....

#MeToo #Κιμούλης #ΖεταΔουκα",,,motherfucker,Twitter Web App,el,1355168373219487744
A__Provocateur,2021-01-29T14:57:06Z,Νταξ συγγνώμη κιόλας που βγήκαν να καταγγείλουν λεκτική ή/και σωματική ή/και σεξουαλική κακοποίηση γυναίκες ηθοποιοί χωρίς να τις ξέρει η #διαβατη ! Tην επόμενη φορά να τις περνάει απο οντισιόν. #Σπυροπουλος #ΖεταΔουκα #κιμουλης #μποτση #MeToo https://t.co/zQcY9AYfV5,,,Όλοι αξίζουμε πρωϊνό sex και pancakes.,Twitter Web App,el,1355168096684810244
katerin24818635,2021-01-29T14:56:38Z,Καλό που επιτέλους άνοιξαν τα στόματα για όλη αυτή την τραγική κατάσταση που επικρατεί σε εργασιακό περιβάλλον αλλά κάποιος πρέπει να μιλήσει και για αυτές τις γυναίκες και άντρες που δεν είναι «διάσημοι»και δυστυχώς δεν έχει τέτοια δύναμη η φωνή τους... #metoo,,,"Blah,Blah,Blah",Twitter for iPhone,el,1355167976610271232
NicolinaGerry,2021-01-29T14:55:56Z,"Ήρθε η ώρα σας μουνόπανα, δεν θα ξανακοιμηθεί κανεις σας ήσυχος. Έφτασαν οι νύχτες που θα κοιμόμαστε εμεις πια ανάλαφρες. #metoo",,,Ξινόμουνο.,Twitter for iPhone,el,1355167802504654852
PGfgyjMeNtf7L2N,2021-01-29T14:54:14Z,"Όχι δεν υπάρχει λεκτική βία και αναπαραγωγή έμφυλων στερεοτύπων...ειναι φυσιολογικό να σχολιάζεις τον στηθοδεσμο και μέχρι που φτάνει το στήθος μιας γυναίκας ..Δεν θυμάμαι να ειχαν ασχοληθεί ΠΟΤΕ με τέτοιους όρους  για τους άνδρες/ πολιτικούς ή μη..#metoo
Το λυπηρό γράφει γυναίκα https://t.co/0Z5enrCe32",,,All you need is love..✌,Twitter for Android,el,1355167374874456064
Tony2371731274,2021-01-29T14:53:51Z,"Από Δευτέρα να δούμε τι άλλο θα δούμε ....περιμένουμε και από Αναστασόπουλου καταγγελία για ακόμη έναν ""κύριο"" που μάλλον εχει και αυτός lower όποτε γ@μαει και δερνει 🤬🤬🤬🤬 #MeToo",,,,Twitter Web App,el,1355167278908760070
DimitraAntonia7,2021-01-29T14:50:21Z,"Φανταστείτε πόσο άσχημα ένιωσαν οι γυναίκες αυτές. Ήταν στην αρχή της καριέρας τους, γεμάτες όνειρα και συνάντησαν κάποιον σε θέση ισχύος, που τις κακοποίησε ψυχικά ή σωματικά. Και δεν μπορούσαν να μιλήσουν για αυτό, για να μην μείνουν άνεργες. #MeToo #Κιμουλης #Σπυροπουλος",,,"Be the change you want to see in the world!
Keep calm & watch TV😎📺🍿",Twitter for Android,el,1355166395236020224
ipopgr,2021-01-29T14:50:01Z,👉Δώρα Χρυσικού​: «Καιρός ήταν. Τώρα είναι της μόδας η αλήθεια» #metoo #ipopgr https://t.co/ldsFV8aUNw,,,https://t.co/Z0d35eV2HD,Twitter Web App,el,1355166314378252288
Kouti_Pandoras,2021-01-29T14:46:22Z,"Αιώνες κι αιώνες πέρασαν με τη γυναίκα θήραμα ή κτήμα, ενίοτε δε και απλό πράγμα, που, δίχως να το ρωτήσουν, το μετακινούν από σπίτι σε σπίτι σαν τμήμα της προίκας 
#MeToo https://t.co/jt6CsBynRG",,,,Hootsuite Inc.,el,1355165394898726912
Vickytax1,2021-01-29T14:46:16Z,"Μιλήστε!!!!
Αυτός που το έκανε σε σας και κανείς δεν το είδε ούτε το άκουσε και δεν μπορείτε να το αποδείξετε,   πάντα έτσι το κάνει! #MeToo https://t.co/AaoUZ5oXXY",,,,Twitter for iPhone,el,1355165371171532804
hotdoc_mag,2021-01-29T14:46:16Z,"Αιώνες κι αιώνες πέρασαν με τη γυναίκα θήραμα ή κτήμα, ενίοτε δε και απλό πράγμα, που, δίχως να το ρωτήσουν, το μετακινούν από σπίτι σε σπίτι σαν τμήμα της προίκας 
#MeToo https://t.co/sTmBQRT9yb",,,,Hootsuite Inc.,el,1355165367568650242
Trishyloves,2021-01-29T14:45:58Z,Ένα τεράστιο μπράβο στις γυναίκες που βρήκαν τη δύναμη και μίλησαν! Ειναι η περίοδος που κάτι πραγματικά αλλάζει! #MeToo,,,"Pls don't dm me.
I'm just tweeting.",Twitter Web App,el,1355165293350367235
Mia_Kyr1,2021-01-29T14:45:26Z,"Η τελευταία τάση της ""μόδα"" είναι η αλήθεια κ θα φορεθεί πολύ φέτος. Από γυναίκες κ άντρες 😌 #MeToo #Σπυροπουλος https://t.co/r46CcMff5K",,,"I handled it like a champion, no matter how many times I get hit, I always get back up.",Twitter for Android,el,1355165158067331074
GiannisMpathas,2021-01-29T14:43:24Z,"Ψώνισε από σβέρκο.
#Σπυροπουλος #κιμουλης #MeToo https://t.co/HDdRivVyXr",,,Επίτιμος καναλάρχης - Σπανακόρυζο fighter,Twitter Web App,el,1355164649851916289
GRasadoros,2021-01-29T14:42:43Z,Το πρώτο #MeToo στα ελληνικά γήπεδα https://t.co/KR5QNbtMdp,,,"🛵  RTs not endorsements  🛵
#team_Αθλητική_Ένωσις_Κωνσταντινουπόλεως",Twitter for Android,el,1355164474643197953
MotoKross6,2021-01-29T14:41:16Z,"Λέει ο Σταρόβας αποκλείται ο Κωστας Σπυροπουλος είναι καλός άνθρωπος και το όνειρο του μισού γυναικείου πληθυσμού
Αντε γ@@@ και εσύ 
 #MeToo #κιμουλη #σπυροπουλος",,,,Twitter Web App,el,1355164113232662534
romanbox,2021-01-29T14:40:31Z,"Προϊσταμένη μου σε εταιρεία, πριν 20 χρόνια, επέμενε να την πάω σπίτι μετά το τέλος της δουλειάς, με πολλά υποσχόμενο ύφος. Δεν την πήγα. #MeToo",,,"Θεριό ενήμερο και μισόθεος. Πιστεύω στον Εθνο-εκκεντρισμό, στην κατάκτηση της αθανασίας και του διαστήματος.",Twitter for Android,el,1355163921020293121
Alexxakta,2021-01-29T14:35:46Z,"Είναι καιρός να ανοίξουν κι άλλα στόματα σε άλλους κλάδους για την ψυχολογική βία και την εξάντληση που ζουν καθημερινα οι εργαζόμενοι. Στον κλάδο της υγείας για παράδειγμα, σε μεγάλους ιατρικούς ομίλους ας πουμε #Σπυροπουλος #MeToo #MeToo #ΜεΤηΣοφια #ΜεΤηΖετα",,,,Twitter Web App,el,1355162727493349382
Ilias_Pitbull,2021-01-29T14:35:12Z,"Αυτά συμβαίνουν σε όλη την Ελλάδα...με τους ""πρόσφυγες"" που μας μπολιάζουν και οι γυναίκες δεν τολμάνε να κυκλοφορήσουν μόνες ειδικά όταν πέσει η νύχτα...

#MeToo

https://t.co/s5nSoxgIi6",,,"Η ΕΛΛΑΔΑ ΣΤΟΥΣ ΕΛΛΗΝΕΣ!
ΛΑΟΣ - ΣΤΡΑΤΟΣ - ΕΘΝΙΚΙΣΜΟΣ",Twitter for Android,el,1355162583905525766
re_lonora,2021-01-29T14:35:02Z,"Δλδ ο #σταροβας λέει το ίδιο περίπου που μου είχε πει ΓΥΝΑΊΚΑ, ΜΕ 2 ΚΟΡΕΣ ΚΙΟΛΑΣ, ""Ε εντάξει άμα στην έπεφτε ο γιος αντί για τον πατέρα θα καθόσουν, δεν θα είχες πρόβλημα"".
Ειλικρινά πείτε μου σ αυτή την βλακεια πώς απαντάς;  #MeToo #κιμουλη #σπυροπουλος",,,,Twitter for Android,el,1355162544042897412
Aria_dni,2021-01-29T14:33:47Z,"Το θλιβερό είναι πως ακόμα και σήμερα με το κίνημα #MeToo να βρίσκεται στα ύψη, πάλι υπάρχουν άνθρωποι που δεν πιστεύουν τα θύματα. Είναι όλοι όσοι εθελοτυφλουν.. αυτοί που και αποδείξεις να δουν πάλι θα κλείσουν τα μάτια τους κ θα προσποιηθουν πως όλα είναι ψέματα. https://t.co/kmYyHt7Xhs",,,"Just a girl who loves to write mystery/thriller & drama. I love taking photographs of beautiful places and talking about poetry.
Writer 
#writingcommunity",Twitter for Android,el,1355162229906305025
Mando_Buc,2021-01-29T14:33:28Z,"'Επεσαν οι μάσκες την εποχή που έγιναν υποχρεωτικές!
#ΖεταΔουκα #Κιμουλης #Σπυροπουλος #μποτση #MeToo",,,Freelancer Photographer 📸,Twitter Web App,el,1355162146343186437
Dpap92,2021-01-29T14:33:14Z,"Όσοι ρωτάτε «γιατί τώρα», «γιατί δεν αντέδρασε» και όλα αυτά τα «γιατί», προτείνω να δείτε το βίντεο από Μαίρη Συνατσάκη που παρουσιάζει δεδομένα και προσπαθεί να εξηγήσει κάποια πράγματα για τη σεξουαλική παρενόχληση. #Σπυροπουλος #μπεκατωρου #MeToo https://t.co/a1CtDLK1QD",,,I don't fck with bullshit & I like memes,Twitter Web App,el,1355162089539723264
vaQmpo5RD3bRS6n,2021-01-29T14:31:48Z,"To #MeToo  είναι πολύ σημαντικό διότι η ελληνική κοινωνία πολλά τα θεωρούσε ταμπού. 
Δεν μιλάμε μόνο για σεξουαλική παρενόχληση.
Όχι.
Αλλά για το κλίμα βίας &amp; απειλών σε οικογένεια, εργασιακό χώρο κτλ.
Μιλήστε - αντιδράστε.",,,Τι σπουδάζουμε εδώ;,Twitter Web App,el,1355161728095543298
Eleni_1993,2021-01-29T14:31:19Z,"#MeToo ΓΙΑΤΙ τώρα⁉️
ΓΙΑΤΙ δυστυχώς για να έχεις αποτελέσματα θα πρέπει να έχεις δύναμη,ισχυρή θέση στην κοινωνία και ανθρώπους που πραγματικά θα είναι δίπλα σου όταν θα ανοίξεις πόλεμο με το τέρας που βασάνισε την ψυχή και το σώμα σου.ΓΥΝΑΙΚΕΣ ΕΝΩΜΕΝΕΣ #ποτέ ΝΙΚΗΜΕΝΕΣ..love..👊💖 https://t.co/URLFcr4SXF",,,"11:11  .•.  👁
#metoo #womenspower",Twitter for Android,el,1355161606808870912
s_vasilo,2021-01-29T14:30:06Z,"Συμπονώ όλες όσες παρενοχλήθηκαν ή κακοποιήθηκαν &amp;αναγκάστηκαν να μείνουν στη δουλειά για να ζήσουν.

Και θαυμάζω αυτές που τα βρόντηξαν&amp;έφυγαν, αναλαμβάνοντας την ευθύνη απέναντι στον εαυτό τους&amp;την κοινωνία, βάζοντας τον αυτοσεβασμό τους πάνω κι από την επιβίωση
#metoogr
#MeToo",,,,Twitter for Android,el,1355161301023125506
netcommentator,2021-01-29T14:29:47Z,"Το μοναδικό όνομα το άφησα για ευνόητους λόγους μιας και όπως λέει στο προφίλ του είναι και στέλεχος της ΝΔ, είσαστε απλά μεγάλοι ξεφτίλες
#ΜεΤηΖετα #ΜεΤηΣοφια #μπεκατώρου #νδ #ΝΔ #ΝΔ_Χουντα #ΝΔ_αλητες #MeToo https://t.co/txe8hgtN8e",,,"World traveler,experiencing the world",Twitter for Android,el,1355161222182821891
Prokanas,2021-01-29T14:29:34Z,"Όσα έχουν γίνει γνωστά είναι μόνο η κορυφή του παγόβουνου. Να χαιρετίσουμε και τα πολλά ""μικρά"" #metoo που κυκλοφορούν μέσω εσωτερικής αλληλογραφίας η σε προσωπικά μηνύματα όχι για δημοσιοποίηση.",,,"he/him/his
Shoegazer",Twitter Web App,el,1355161165979131910
AgrotisSotis,2021-01-29T14:29:10Z,Δικαίωμά σ ν δηλώνεις τότε ήμουν μικρή δν ήξερα φοβόμουν κ έπρεπε να περάσουν 23 χρόνια για να καταλάβεις ή να μη φοβάσαι?Δικαίωμα μ να σέβομαι αυτούς που θυσίασαν υλικά πράγματα δόξα καριέρα k έκαναν ότι έπρεπε ΤΗΝ ΩΡΑ ΠΟΥ ΕΠΡΕΠΕ για να προστατέψουν την αξιοπρέπειά τους.#MeToo,,,Είναι ένας αχρηστος,Twitter Web App,el,1355161067438137344
Denniskathrin1,2021-01-29T14:22:28Z,Και η λίστα μεγαλώνει... #metoo #Zeta #Λαμπρη #μποτση #μιληστε #SpeakOut #Κιμουλης #σπυροπουλος #pamedanai https://t.co/3joElcXjOr,,,,Twitter for Android,el,1355159381768335365
Dimi_Gi,2021-01-29T14:20:18Z,Ακόμα και το #MeToo το ξεφτιλίσαμε..Σε όλο τον κόσμο αναφέρεται για sex offences εδώ τα μπλέξαμε όλα πάλι όλα,,,"“29,086 measures barley 37 months Kushim”. AEK",Twitter for iPhone,el,1355158834705264642
SputnikGreece,2021-01-29T14:20:00Z,"Πληθαίνουν οι κατηγορίες για σεξουαλική παρενόχληση από ηθοποιούς κατά του Κώστα Σπυρόπουλου. #Σπυροπουλος #καταγγελια #metoo 

https://t.co/TURb5ZsuYJ",,,Μιλάμε για όσα οι άλλοι σιωπούν,TweetDeck,el,1355158758192783364
mangelipi,2021-01-29T14:18:56Z,#MeToo: Η εβδομάδα που Ελλάδα και Κύπρος άρχισαν να ξυπνούν https://t.co/oJyT8ciwV1,,,"researcher, trainer, project coordinator @MIgsCy. Loving the sun, the sea and Gender & Media theories",Twitter for Android,el,1355158489912533003
kostisbitsios,2021-01-29T14:18:53Z,Και τέταρτη ηθοποιός καταγγέλει τον #Σπυρόπουλο! #Σαμπανίκου: Περίμενα χρόνια τη στιγμή https://t.co/DJuk6Zm3qs #Σπυροπουλος #μποτση #ΤζένηΜπότση #ΛουκίαΜιχαλά #Μιχαλά #Σταρόβας #ΑγγελικήΛάμπρη #KoniElena #ElenaKoni #popupiliana #ΜεΤηΣοφια #ΜεΤηΖετα #MeToo #womenempowerment #news,,,Lawyer. Activist https://t.co/ZojsyDfI53 8 years in my life - A TRUE COLLECTOR (according to #BarbraStreisand),Twitter Web App,el,1355158477174419459
gagaouga,2021-01-29T14:15:22Z,"Πως στις πορείες για το BLM οι μισοί που είχαν βγει στο δρόμο ήταν λευκοί;
Ε, και στο #MeToo οι μισοί που θα βγουν θα πρέπει να είναι άντρες. 

Έτσι αλλάζει ο κόσμος. Με συνοχή, όχι διάσπαση.
 #Σπυροπουλος",,,,Twitter Web App,el,1355157592184647683
kostisbitsios,2021-01-29T14:15:12Z,"Και 4η ηθοποιός καταγγέλει τον #Σπυρόπουλο!
#Σαμπανίκου: «Περίμενα χρόνια τη στιγμή»

https://t.co/DJuk6Zm3qs

#Σπυροπουλος #μποτση #ΤζένηΜπότση #ΛουκίαΜιχαλά #Μιχαλά #Σταρόβας #ΑγγελικήΛάμπρη @Konstantinos #ΜεΤηΣοφια #ΜεΤηΖετα #κιμουλη #κιμουλης #apotis4stis5 #Σαμπανίκου #MeToo",,,Lawyer. Activist https://t.co/ZojsyDfI53 8 years in my life - A TRUE COLLECTOR (according to #BarbraStreisand),Twitter Web App,el,1355157553160855560
sleepygeor,2021-01-29T14:14:25Z,"Φανταστείτε να έχετε υποστεί τραύμα, να νιώθετε φόβο, ενοχές. Ο περίγυρος να κατακρίνει εσάς γι’αυτό. Εκεί βασίζονται οι θύτες.Στην «αδυναμία»του θύματος,στη «δύναμη» τη δική τους. Το θύμα, μετά από καιρό θα θεραπευτεί. Ο θύτης πάλι δεν θα γίνει ποτέ άνθρωπος #Σπυροπουλος #metoo",,,"Χιούμορ 🤡, τηλεόραση 📺 & πολλά memes 🤪Μέλος για καιρό, όμως με τρώγαν τα κυκλώματα. Μία μέρα του Δεκέμβρη του ιστορικού 2020💀, αποφάσισα να φανώ",Twitter for iPhone,el,1355157352333389824
fubuki_lulu,2021-01-29T14:12:50Z,Περιμένουμε λοιπόν με χαρά την  ανακοίνωση της συνεργασίας της Κας Διαβάτη  με τον Κιμούλη  για μια ολόκληρη θεατρική σεζόν. Καλά να περάσετε. #MeToo,,,το ακάου είναι καθαρό να πατάτε στα πατάκια. https://t.co/f3w36PKHvm,Twitter for iPhone,el,1355156955137003520
Sasa1297193809,2021-01-29T14:12:27Z,"Θεωρείται 'τυχη' που σε παρενόχλησε ένας ας πουμε 'ωραίος'; δηλαδή  σου έκανε την 'τιμή' και εσύ το παίζεις θιγμενη; Σταροβα, κόψε τις μισογυνιστικες συμπεριφορές για να καλύψεις το φιλαράκι σου!Πονάτε, το ξέρω!#MeToo #metoogr #μποτση",,,"αγαπώ τη φωτογραφία/
θελω την ησυχία μου/
μισω την αδικία και το ψεμα",Twitter for Android,el,1355156859490074630
PtsVasaki,2021-01-29T14:12:19Z,"Πριν ανοίξουν ξανά δραστηριότητες, αθλήματα, γυμναστήρια, θέατρα, πίστες κλπ. ας γίνει μια εκκαθάριση του ανθρώπινου δυναμικού, μπας και μείνει το ανθρώπινο. #Κιμουλης #Σπυροπουλος #ΖεταΔουκα #Μποτση #Μπεκατώρου #ΜεΤηΣοφια #MeToo",,,Είμαι η ανεπίσημη του @Chris_toforos μην παιδεύεστε. ΙΟΝ αμυγδάλου για πάντα 🍫,Twitter for Android,el,1355156825310695429
roufixtra,2021-01-29T14:11:19Z,"Χριστίνα Πολίτη: Το μήνυμα στήριξης στον σύντροφο της, Κώστα Σπυρόπουλο https://t.co/OszOYE0IKr #Σπυροπουλος #MeToo",,,"Όπως η ρουφήχτρα καταπίνει τα πάντα, έτσι και ο ιστότοπος μας ""ρουφάει"" τις καλύτερες ειδήσεις από το ελληνικό διαδίκτυο!",Roufixtra,el,1355156572301897728
DimitraAntonia7,2021-01-29T14:09:23Z,Πόση σαπιλα υπήρχε τελικά πίσω από τον λαμπερό κόσμο του θεάτρου. Φανταστείτε να ανοίξουν τα στόματα και για τον χώρο της τηλεόρασης τι έχει να γίνει...Και γενικά για όλους τους εργασιακούς χώρους...#Σπυροπουλος #Κιμουλης #MeToo,,,"Be the change you want to see in the world!
Keep calm & watch TV😎📺🍿",Twitter for Android,el,1355156089390702594
